<?xml version="1.0" encoding="iso-8859-1"?>
<!DOCTYPE DataObject SYSTEM "DataObject.dtd">
<DataObject
	DTDVersion="05.05.12"
	SurrId="04456371760003"
	CodedValuesList="False"
	ImageReference=" "
	IsRemoteAccessible="False"
	UseQuotedIdentifiers="False"
	XdaConnector="SQL"
	SuperClass="DataObject"
	LockMode="AllApplicableAttributes"
	>
	<Attributes>
		<Attribute
			Name="ReposName1"
			PreventUserUpdates="False"
			ValueRequired="True"
			LayoutByDefault="True"
			Persistent="True"
			>
			<DataType
				DataType="VarChar"
				Size="50"
			/>
			<Derivation
				DerivationType="None"
			/>
			<Validation
				ValidationType="Condition"
			/>
		</Attribute>
		<Attribute
			Name="ReposName2"
			PreventUserUpdates="False"
			ValueRequired="True"
			LayoutByDefault="True"
			Persistent="True"
			>
			<DataType
				DataType="VarChar"
				Size="50"
			/>
			<Derivation
				DerivationType="None"
			/>
			<Validation
				ValidationType="Condition"
			/>
		</Attribute>
		<Attribute
			Name="AppName1"
			PreventUserUpdates="False"
			ValueRequired="True"
			LayoutByDefault="True"
			Persistent="True"
			>
			<DataType
				DataType="VarChar"
				Size="50"
			/>
			<Derivation
				DerivationType="None"
			/>
			<Validation
				ValidationType="Condition"
			/>
		</Attribute>
		<Attribute
			Name="AppName2"
			PreventUserUpdates="False"
			ValueRequired="True"
			LayoutByDefault="True"
			Persistent="True"
			>
			<DataType
				DataType="VarChar"
				Size="50"
			/>
			<Derivation
				DerivationType="None"
			/>
			<Validation
				ValidationType="Condition"
			/>
		</Attribute>
		<Attribute
			Name="FormName1"
			PreventUserUpdates="False"
			ValueRequired="False"
			LayoutByDefault="True"
			Persistent="True"
			>
			<DataType
				DataType="VarChar"
				Size="50"
			/>
		</Attribute>
		<Attribute
			Name="FormName2"
			PreventUserUpdates="False"
			ValueRequired="False"
			LayoutByDefault="True"
			Persistent="True"
			>
			<DataType
				DataType="VarChar"
				Size="50"
			/>
		</Attribute>
		<Attribute
			Name="ObjectType"
			PreventUserUpdates="False"
			ValueRequired="True"
			LayoutByDefault="True"
			Persistent="True"
			>
			<DataType
				DataType="VarChar"
				Size="50"
			/>
			<Derivation
				DerivationType="Default"
				>
				<DefaultValue><![CDATA['HTML_APP']]></DefaultValue>
			</Derivation>
			<Validation
				ValidationType="CodedValuesList"
				CodedValuesList="Valid_ObjectType"
			/>
		</Attribute>
		<Attribute
			Name="DiffComment"
			PreventUserUpdates="False"
			ValueRequired="False"
			LayoutByDefault="True"
			Persistent="True"
			>
			<DataType
				DataType="VarChar"
				Size="250"
			/>
			<Derivation
				DerivationType="None"
			/>
			<Description><![CDATA[This will say something like Added to Repos2 or Removed from Repos 2 - or modified (each object will have different criteria, e.g #attrs, lines of code, methods, etc.)]]></Description>
			<Validation
				ValidationType="Condition"
			/>
		</Attribute>
		<Attribute
			Name="Total_1_Line_Cnt"
			PreventUserUpdates="False"
			ValueRequired="False"
			LayoutByDefault="True"
			Persistent="True"
			>
			<DataType
				DataType="Integer"
			/>
			<Derivation
				DerivationType="Default"
				>
				<DefaultValue><![CDATA[0]]></DefaultValue>
			</Derivation>
			<Validation
				ValidationType="Condition"
			/>
		</Attribute>
		<Attribute
			Name="Total_2_Line_Cnt"
			PreventUserUpdates="False"
			ValueRequired="False"
			LayoutByDefault="True"
			Persistent="True"
			>
			<DataType
				DataType="Integer"
			/>
			<Derivation
				DerivationType="Default"
				>
				<DefaultValue><![CDATA[0]]></DefaultValue>
			</Derivation>
			<Validation
				ValidationType="Condition"
			/>
		</Attribute>
		<Attribute
			Name="Line_Cnt_Diff"
			PreventUserUpdates="True"
			ValueRequired="False"
			LayoutByDefault="True"
			Persistent="True"
			>
			<DataType
				DataType="Integer"
			/>
			<Derivation
				DerivationType="Formula"
				>
				<Formula><![CDATA[ Total_1_Line_Cnt  -  Total_2_Line_Cnt ]]></Formula>
			</Derivation>
			<Validation
				ValidationType="Condition"
			/>
		</Attribute>
		<Attribute
			Name="Total_1_Method_Cnt"
			PreventUserUpdates="False"
			ValueRequired="False"
			LayoutByDefault="True"
			Persistent="True"
			>
			<DataType
				DataType="Integer"
			/>
			<Derivation
				DerivationType="Default"
				>
				<DefaultValue><![CDATA[0]]></DefaultValue>
			</Derivation>
			<Validation
				ValidationType="Condition"
			/>
		</Attribute>
		<Attribute
			Name="Total_2_Method_Cnt"
			PreventUserUpdates="False"
			ValueRequired="False"
			LayoutByDefault="True"
			Persistent="True"
			>
			<DataType
				DataType="Integer"
			/>
			<Derivation
				DerivationType="Default"
				>
				<DefaultValue><![CDATA[0]]></DefaultValue>
			</Derivation>
			<Validation
				ValidationType="Condition"
			/>
		</Attribute>
		<Attribute
			Name="RecordSource1_Cnt"
			PreventUserUpdates="False"
			ValueRequired="False"
			LayoutByDefault="True"
			Persistent="True"
			>
			<DataType
				DataType="Integer"
			/>
			<Derivation
				DerivationType="Default"
				>
				<DefaultValue><![CDATA[0]]></DefaultValue>
			</Derivation>
			<Validation
				ValidationType="Condition"
			/>
		</Attribute>
		<Attribute
			Name="RecordSource2_Cnt"
			PreventUserUpdates="False"
			ValueRequired="False"
			LayoutByDefault="True"
			Persistent="True"
			>
			<DataType
				DataType="Integer"
			/>
			<Derivation
				DerivationType="Default"
				>
				<DefaultValue><![CDATA[0]]></DefaultValue>
			</Derivation>
			<Validation
				ValidationType="Condition"
			/>
		</Attribute>
		<Attribute
			Name="Transition1_Cnt"
			PreventUserUpdates="False"
			ValueRequired="False"
			LayoutByDefault="True"
			Persistent="True"
			>
			<DataType
				DataType="Integer"
			/>
			<Derivation
				DerivationType="Default"
				>
				<DefaultValue><![CDATA[0]]></DefaultValue>
			</Derivation>
			<Validation
				ValidationType="Condition"
			/>
		</Attribute>
		<Attribute
			Name="Transition2_Cnt"
			PreventUserUpdates="False"
			ValueRequired="False"
			LayoutByDefault="True"
			Persistent="True"
			>
			<DataType
				DataType="Integer"
			/>
			<Derivation
				DerivationType="Default"
				>
				<DefaultValue><![CDATA[0]]></DefaultValue>
			</Derivation>
			<Validation
				ValidationType="Condition"
			/>
		</Attribute>
		<Attribute
			Name="Method_Cnt_Diff"
			PreventUserUpdates="True"
			ValueRequired="False"
			LayoutByDefault="True"
			Persistent="True"
			>
			<DataType
				DataType="Integer"
			/>
			<Derivation
				DerivationType="Formula"
				>
				<Formula><![CDATA[ Total_1_Method_Cnt  -  Total_2_Method_Cnt ]]></Formula>
			</Derivation>
			<Validation
				ValidationType="Condition"
			/>
		</Attribute>
		<Attribute
			Name="DiffState"
			PreventUserUpdates="False"
			ValueRequired="False"
			LayoutByDefault="True"
			Persistent="True"
			>
			<DataType
				DataType="VarChar"
				Size="12"
			/>
			<Derivation
				DerivationType="Default"
				>
				<DefaultValue><![CDATA['SAME']]></DefaultValue>
			</Derivation>
			<Validation
				ValidationType="CodedValuesList"
				CodedValuesList="List_DiffState"
			/>
		</Attribute>
		<Attribute
			Name="RecordSourceCnt_Diff"
			PreventUserUpdates="True"
			ValueRequired="False"
			LayoutByDefault="True"
			Persistent="True"
			>
			<DataType
				DataType="Integer"
			/>
			<Derivation
				DerivationType="Formula"
				>
				<Formula><![CDATA[ RecordSource1_Cnt  -  RecordSource2_Cnt ]]></Formula>
			</Derivation>
			<Validation
				ValidationType="Condition"
			/>
		</Attribute>
		<Attribute
			Name="TransitionCnt_Diff"
			PreventUserUpdates="True"
			ValueRequired="False"
			LayoutByDefault="True"
			Persistent="True"
			>
			<DataType
				DataType="Integer"
			/>
			<Derivation
				DerivationType="Formula"
				>
				<Formula><![CDATA[ Transition1_Cnt  -  Transition2_Cnt ]]></Formula>
			</Derivation>
			<Validation
				ValidationType="Condition"
			/>
		</Attribute>
		<Attribute
			Name="FormType"
			PreventUserUpdates="False"
			ValueRequired="False"
			LayoutByDefault="True"
			Persistent="True"
			>
			<DataType
				DataType="VarChar"
				Size="50"
			/>
			<Derivation
				DerivationType="Default"
				>
				<DefaultValue><![CDATA['HTML']]></DefaultValue>
			</Derivation>
			<Validation
				ValidationType="Condition"
			/>
		</Attribute>
	</Attributes>
	<Indexes>
		<Index
			Name="PKObjectDiff"
			Primary="True"
			Unique="True"
			IgnoreNulls="False"
			>
			<Index_Attribute
				Name="ReposName1"
				Descending="False"
			/>
			<Index_Attribute
				Name="AppName1"
				Descending="False"
			/>
			<Index_Attribute
				Name="ReposName2"
				Descending="False"
			/>
			<Index_Attribute
				Name="AppName2"
				Descending="False"
			/>
			<Index_Attribute
				Name="ObjectType"
				Descending="False"
			/>
			<Index_Attribute
				Name="FormName1"
				Descending="False"
			/>
			<Index_Attribute
				Name="FormName2"
				Descending="False"
			/>
			<Index_Attribute
				Name="FormType"
				Descending="False"
			/>
		</Index>
	</Indexes>
	<SingularCaption><![CDATA[Object Difference]]></SingularCaption>
	<PluralCaption><![CDATA[Object Differences]]></PluralCaption>
	<VLSDeployment
		DeploySecurityInfo="False"
	/>
	<CodedValuesList
		StoredAttribute=" "
		DisplayAttribute=" "
	/>
	<Description><![CDATA[ObjectDiff is an internal object created and maintained by Java code.  This holds the difference information between 2 objects (DataObject, Attribute, Query, etc)]]></Description>
	<Comments><![CDATA[ ]]></Comments>
</DataObject>