<?xml version="1.0" encoding="iso-8859-1"?>
<!DOCTYPE DataObject SYSTEM "DataObject.dtd">
<DataObject
	SurrId="0416912984.tband.0006"
	CodedValuesList="False"
	IsRemoteAccessible="False"
	UseQuotedIdentifiers="False"
	SuperClass="DataObject"
	LockMode="AllApplicableAttributes"
	ImageReference=" "
	XdaConnector="SQL"
	DTDVersion="05.05.12"
	>
	<CodedValuesList
		DisplayAttribute=" "
		StoredAttribute=" "
	/>
	<VLSDeployment
		DeploySecurityInfo="False"
	/>
	<SingularCaption><![CDATA[*]]> </SingularCaption>
	<PluralCaption><![CDATA[*]]> </PluralCaption>
	<Description><![CDATA[ These are the attributes defined by this record source that are placed and displayed in an HTML page or Java Form.]]> </Description>
	<Comments><![CDATA[ ]]> </Comments>
	<Attributes>
		<Attribute
			Name="RepositoryName"
			PreventUserUpdates="False"
			ValueRequired="True"
			LayoutByDefault="True"
			Persistent="True"
			>
			<DataType
				DataType="VarChar"
				Size="50"
			/>
			<Validation
				ValidationType="Condition"
			/>
			<Derivation
				DerivationType="None"
			/>
			<Caption><![CDATA[Repository Name]]></Caption>
		</Attribute>
		<Attribute
			Name="ApplicationName"
			Persistent="True"
			PreventUserUpdates="False"
			ValueRequired="True"
			LayoutByDefault="True"
			>
			<DataType
				DataType="VarChar"
				Size="100"
			/>
			<Validation
				ValidationType="Condition"
			/>
			<Derivation
				DerivationType="None"
			/>
			<Caption><![CDATA[Application Name]]></Caption>
		</Attribute>
		<Attribute
			Name="FormName"
			Persistent="True"
			PreventUserUpdates="False"
			ValueRequired="True"
			LayoutByDefault="True"
			>
			<DataType
				DataType="VarChar"
				Size="100"
			/>
			<Validation
				ValidationType="Condition"
			/>
			<Derivation
				DerivationType="None"
			/>
			<Caption><![CDATA[Form Name]]></Caption>
		</Attribute>
		<Attribute
			Name="BusinessObject"
			Persistent="True"
			PreventUserUpdates="False"
			ValueRequired="True"
			LayoutByDefault="True"
			>
			<DataType
				DataType="VarChar"
				Size="50"
			/>
			<Validation
				ValidationType="Condition"
			/>
			<Derivation
				DerivationType="None"
			/>
			<Caption><![CDATA[Business Object]]></Caption>
		</Attribute>
		<Attribute
			Name="AttrName"
			Persistent="True"
			PreventUserUpdates="False"
			ValueRequired="True"
			LayoutByDefault="True"
			>
			<DataType
				DataType="VarChar"
				Size="50"
			/>
			<Validation
				ValidationType="Condition"
			/>
			<Derivation
				DerivationType="None"
			/>
			<Caption><![CDATA[AttributeName]]></Caption>
		</Attribute>
		<Attribute
			Name="isScalar"
			Persistent="True"
			PreventUserUpdates="False"
			ValueRequired="True"
			LayoutByDefault="True"
			>
			<DataType
				DataType="Boolean"
			/>
			<Derivation
				DerivationType="Default"
				>
				<DefaultValue><![CDATA[false]]> </DefaultValue>
			</Derivation>
			<Validation
				ValidationType="Condition"
			/>
			<Caption><![CDATA[Scalar?]]></Caption>
		</Attribute>
		<Attribute
			Name="isPlaced"
			Persistent="True"
			PreventUserUpdates="False"
			ValueRequired="True"
			LayoutByDefault="True"
			>
			<DataType
				DataType="Boolean"
			/>
			<Derivation
				DerivationType="Default"
				>
				<DefaultValue><![CDATA[false]]> </DefaultValue>
			</Derivation>
			<Validation
				ValidationType="Condition"
			/>
			<Caption><![CDATA[UnPlaced?]]></Caption>
		</Attribute>
		<Attribute
			Name="isDisplayed"
			Persistent="True"
			PreventUserUpdates="False"
			ValueRequired="True"
			LayoutByDefault="True"
			>
			<DataType
				DataType="Boolean"
			/>
			<Derivation
				DerivationType="Default"
				>
				<DefaultValue><![CDATA[false]]> </DefaultValue>
			</Derivation>
			<Validation
				ValidationType="Condition"
			/>
			<Caption><![CDATA[Is Displayed?]]></Caption>
		</Attribute>
		<Attribute
			Name="RSID"
			PreventUserUpdates="False"
			ValueRequired="True"
			LayoutByDefault="True"
			Persistent="True"
			>
			<DataType
				DataType="Integer"
			/>
			<Derivation
				DerivationType="Default"
				>
				<DefaultValue><![CDATA[1]]></DefaultValue>
			</Derivation>
			<Validation
				ValidationType="Condition"
			/>
			<Caption><![CDATA[RecordSource ID]]></Caption>
		</Attribute>
		<Attribute
			Name="ColumnLabel"
			PreventUserUpdates="False"
			ValueRequired="False"
			LayoutByDefault="True"
			Persistent="True"
			>
			<DataType
				DataType="VarChar"
				Size="150"
			/>
			<Derivation
				DerivationType="None"
				>
				<DefaultValue><![CDATA[]]></DefaultValue>
			</Derivation>
			<Validation
				ValidationType="Condition"
			/>
		</Attribute>
		<Attribute
			Name="ClassName"
			PreventUserUpdates="False"
			ValueRequired="False"
			LayoutByDefault="True"
			Persistent="True"
			>
			<DataType
				DataType="VarChar"
				Size="150"
			/>
			<Derivation
				DerivationType="Default"
				>
				<DefaultValue><![CDATA['default']]></DefaultValue>
			</Derivation>
			<Validation
				ValidationType="Condition"
			/>
		</Attribute>
		<Attribute
			Name="ColumnEnabled"
			PreventUserUpdates="False"
			ValueRequired="True"
			LayoutByDefault="True"
			Persistent="True"
			>
			<DataType
				DataType="Boolean"
			/>
			<Derivation
				DerivationType="Default"
				>
				<DefaultValue><![CDATA[true]]></DefaultValue>
			</Derivation>
			<Validation
				ValidationType="Condition"
			/>
		</Attribute>
	</Attributes>
	<Indexes>
		<Index
			Name="RecordSourceAttrPkey"
			Primary="True"
			Unique="True"
			IgnoreNulls="False"
			>
			<Index_Attribute
				Name="RepositoryName"
				Descending="False"
			/>
			<Index_Attribute
				Name="ApplicationName"
				Descending="False"
			/>
			<Index_Attribute
				Name="FormName"
				Descending="False"
			/>
			<Index_Attribute
				Name="BusinessObject"
				Descending="False"
			/>
			<Index_Attribute
				Name="RSID"
				Descending="False"
			/>
			<Index_Attribute
				Name="AttrName"
				Descending="False"
			/>
			<Index_Attribute
				Name="isScalar"
				Descending="False"
			/>
		</Index>
	</Indexes>
</DataObject>