<?xml version="1.0" encoding="iso-8859-1"?>
<!DOCTYPE DataObject SYSTEM "DataObject.dtd">
<DataObject
	SurrId="0413978431.tband.0005"
	CodedValuesList="False"
	ImageReference=" "
	IsRemoteAccessible="False"
	UseQuotedIdentifiers="False"
	SuperClass="DataObject"
	LockMode="AllApplicableAttributes"
	XdaConnector="SQL"
	DTDVersion="05.05.12"
	>
	<CodedValuesList
		DisplayAttribute=" "
		StoredAttribute=" "
	/>
	<VLSDeployment
		DeploySecurityInfo="False"
	/>
	<SingularCaption><![CDATA[*]]> </SingularCaption>
	<PluralCaption><![CDATA[*]]> </PluralCaption>
	<Description><![CDATA[ These are the Event Condition Actions - rules that only fire Java Methods when an Event (a business state change) occurs.]]> </Description>
	<Comments><![CDATA[ ]]> </Comments>
	<Attributes>
		<Attribute
			Name="RepositoryName"
			PreventUserUpdates="False"
			ValueRequired="True"
			LayoutByDefault="False"
			Persistent="True"
			>
			<DataType
				DataType="VarChar"
				Size="50"
			/>
			<Validation
				ValidationType="Condition"
			/>
			<Derivation
				DerivationType="None"
			/>
			<Caption><![CDATA[Repository Name]]></Caption>
		</Attribute>
		<Attribute
			Name="DataObjectName"
			Persistent="True"
			PreventUserUpdates="False"
			ValueRequired="True"
			LayoutByDefault="True"
			>
			<DataType
				DataType="VarChar"
				Size="50"
			/>
			<Validation
				ValidationType="Condition"
			/>
			<Derivation
				DerivationType="None"
			/>
			<Caption><![CDATA[Data Object]]></Caption>
		</Attribute>
		<Attribute
			Name="ActionName"
			Persistent="True"
			PreventUserUpdates="False"
			ValueRequired="True"
			LayoutByDefault="True"
			>
			<DataType
				DataType="VarChar"
				Size="50"
			/>
			<Validation
				ValidationType="Condition"
			/>
			<Derivation
				DerivationType="None"
			/>
			<Caption><![CDATA[Action Name]]></Caption>
		</Attribute>
		<Attribute
			Name="ActionToPerform"
			Persistent="True"
			PreventUserUpdates="False"
			ValueRequired="False"
			LayoutByDefault="True"
			>
			<DataType
				DataType="Memo"
			/>
			<Validation
				ValidationType="Condition"
			/>
			<Derivation
				DerivationType="None"
			/>
			<Caption><![CDATA[Action to Perform]]></Caption>
		</Attribute>
		<Attribute
			Name="Description"
			Persistent="True"
			PreventUserUpdates="False"
			ValueRequired="False"
			LayoutByDefault="True"
			>
			<DataType
				DataType="Memo"
			/>
			<Validation
				ValidationType="Condition"
			/>
		</Attribute>
		<Attribute
			Name="Condition"
			Persistent="True"
			PreventUserUpdates="False"
			ValueRequired="False"
			LayoutByDefault="True"
			>
			<DataType
				DataType="Memo"
			/>
			<Validation
				ValidationType="Condition"
			/>
		</Attribute>
	</Attributes>
	<Indexes>
		<Index
			Name="ActionPkey"
			Primary="True"
			Unique="True"
			IgnoreNulls="False"
			>
			<Index_Attribute
				Name="RepositoryName"
				Descending="False"
			/>
			<Index_Attribute
				Name="DataObjectName"
				Descending="False"
			/>
			<Index_Attribute
				Name="ActionName"
				Descending="False"
			/>
		</Index>
	</Indexes>
</DataObject>