<?xml version="1.0" encoding="iso-8859-1"?>
<!DOCTYPE DataObject SYSTEM "DataObject.dtd">
<DataObject
	SurrId="0414404847.tband.0002"
	CodedValuesList="False"
	ImageReference=" "
	IsRemoteAccessible="False"
	UseQuotedIdentifiers="False"
	SuperClass="DataObject"
	LockMode="AllApplicableAttributes"
	XdaConnector="SQL"
	DTDVersion="05.05.12"
	>
	<CodedValuesList
		DisplayAttribute=" "
		StoredAttribute=" "
	/>
	<VLSDeployment
		DeploySecurityInfo="False"
	/>
	<SingularCaption><![CDATA[*]]> </SingularCaption>
	<PluralCaption><![CDATA[*]]> </PluralCaption>
	<Description><![CDATA[ This is the Index Data Object - used by DBMS to identify primary and foreign keys.]]> </Description>
	<Comments><![CDATA[ ]]> </Comments>
	<Attributes>
		<Attribute
			Name="RepositoryName"
			PreventUserUpdates="False"
			ValueRequired="True"
			LayoutByDefault="True"
			Persistent="True"
			>
			<DataType
				DataType="VarChar"
				Size="50"
			/>
			<Validation
				ValidationType="Condition"
			/>
			<Derivation
				DerivationType="None"
			/>
			<Caption><![CDATA[Repository Name]]></Caption>
		</Attribute>
		<Attribute
			Name="DataObjectName"
			Persistent="True"
			PreventUserUpdates="False"
			ValueRequired="True"
			LayoutByDefault="True"
			>
			<DataType
				DataType="VarChar"
				Size="50"
			/>
			<Validation
				ValidationType="Condition"
			/>
			<Derivation
				DerivationType="None"
			/>
			<Caption><![CDATA[Data Object]]></Caption>
		</Attribute>
		<Attribute
			Name="IndexName"
			Persistent="True"
			PreventUserUpdates="False"
			ValueRequired="True"
			LayoutByDefault="True"
			>
			<DataType
				DataType="VarChar"
				Size="50"
			/>
			<Validation
				ValidationType="Condition"
			/>
			<Derivation
				DerivationType="None"
			/>
			<Caption><![CDATA[Index Name]]></Caption>
		</Attribute>
		<Attribute
			Name="PrimaryIndx"
			Persistent="True"
			PreventUserUpdates="False"
			ValueRequired="True"
			LayoutByDefault="True"
			>
			<DataType
				DataType="Boolean"
			/>
			<Derivation
				DerivationType="Default"
				>
				<DefaultValue><![CDATA[false]]> </DefaultValue>
			</Derivation>
			<Validation
				ValidationType="Condition"
			/>
			<Caption><![CDATA[Is Primary?]]></Caption>
		</Attribute>
		<Attribute
			Name="UniqueIndx"
			Persistent="True"
			PreventUserUpdates="False"
			ValueRequired="True"
			LayoutByDefault="True"
			>
			<DataType
				DataType="Boolean"
			/>
			<Derivation
				DerivationType="Default"
				>
				<DefaultValue><![CDATA[false]]> </DefaultValue>
			</Derivation>
			<Validation
				ValidationType="Condition"
			/>
			<Caption><![CDATA[Is Unique?]]></Caption>
		</Attribute>
	</Attributes>
	<Indexes>
		<Index
			Name="PKEYIndex"
			Primary="True"
			Unique="True"
			IgnoreNulls="False"
			>
			<Index_Attribute
				Name="RepositoryName"
				Descending="False"
			/>
			<Index_Attribute
				Name="DataObjectName"
				Descending="False"
			/>
			<Index_Attribute
				Name="IndexName"
				Descending="False"
			/>
		</Index>
	</Indexes>
</DataObject>