<?xml version="1.0" encoding="iso-8859-1"?>
<!DOCTYPE DataObject SYSTEM "DataObject.dtd">
<DataObject
	SurrId="0417538787.tband.0005"
	CodedValuesList="False"
	IsRemoteAccessible="False"
	UseQuotedIdentifiers="False"
	SuperClass="DataObject"
	LockMode="AllApplicableAttributes"
	ImageReference=" "
	XdaConnector="SQL"
	DTDVersion="05.05.12"
	>
	<CodedValuesList
		DisplayAttribute=" "
		StoredAttribute=" "
	/>
	<VLSDeployment
		DeploySecurityInfo="False"
	/>
	<SingularCaption><![CDATA[*]]> </SingularCaption>
	<PluralCaption><![CDATA[*]]> </PluralCaption>
	<Description><![CDATA[ These are the relationships used in the specifc QueryObhect (which may be different from the ones in the Repository)]]> </Description>
	<Comments><![CDATA[ ]]> </Comments>
	<Attributes>
		<Attribute
			Name="RepositoryName"
			PreventUserUpdates="False"
			ValueRequired="True"
			LayoutByDefault="True"
			Persistent="True"
			>
			<DataType
				DataType="VarChar"
				Size="50"
			/>
			<Validation
				ValidationType="Condition"
			/>
		</Attribute>
		<Attribute
			Name="QueryObjectName"
			Persistent="True"
			PreventUserUpdates="False"
			ValueRequired="True"
			LayoutByDefault="True"
			>
			<DataType
				DataType="VarChar"
				Size="50"
			/>
			<Validation
				ValidationType="Condition"
			/>
		</Attribute>
		<Attribute
			Name="LeftDataObjectName"
			Persistent="True"
			PreventUserUpdates="False"
			ValueRequired="True"
			LayoutByDefault="True"
			>
			<DataType
				DataType="VarChar"
				Size="50"
			/>
			<Validation
				ValidationType="Condition"
			/>
		</Attribute>
		<Attribute
			Name="RightDataObjectName"
			Persistent="True"
			PreventUserUpdates="False"
			ValueRequired="True"
			LayoutByDefault="True"
			>
			<DataType
				DataType="VarChar"
				Size="50"
			/>
			<Validation
				ValidationType="Condition"
			/>
		</Attribute>
		<Attribute
			Name="RelationshipName"
			Persistent="True"
			PreventUserUpdates="True"
			ValueRequired="False"
			LayoutByDefault="True"
			>
			<DataType
				DataType="VarChar"
				Size="100"
			/>
			<Derivation
				DerivationType="Formula"
				>
				<Formula><![CDATA[LeftDataObjectName +'_JN_'+ RightDataObjectName ]]> </Formula>
			</Derivation>
			<Validation
				ValidationType="Condition"
			/>
		</Attribute>
		<Attribute
			Name="JoinType"
			Persistent="True"
			PreventUserUpdates="False"
			ValueRequired="False"
			LayoutByDefault="True"
			>
			<DataType
				DataType="VarChar"
				Size="15"
			/>
			<Validation
				ValidationType="Condition"
			/>
		</Attribute>
	</Attributes>
	<Indexes>
		<Index
			Name="QueryDataObjPkey"
			Primary="True"
			Unique="True"
			IgnoreNulls="False"
			>
			<Index_Attribute
				Name="RepositoryName"
				Descending="False"
			/>
			<Index_Attribute
				Name="QueryObjectName"
				Descending="False"
			/>
			<Index_Attribute
				Name="LeftDataObjectName"
				Descending="False"
			/>
			<Index_Attribute
				Name="RightDataObjectName"
				Descending="False"
			/>
		</Index>
	</Indexes>
</DataObject>