<?xml version="1.0" encoding="iso-8859-1"?>
<!DOCTYPE DataObject SYSTEM "DataObject.dtd">
<DataObject
	SurrId="04424271350052"
	CodedValuesList="False"
	IsRemoteAccessible="False"
	UseQuotedIdentifiers="False"
	SuperClass="DataObject"
	LockMode="AllApplicableAttributes"
	ImageReference=" "
	XdaConnector="SQL"
	DTDVersion="05.05.12"
	>
	<CodedValuesList
		DisplayAttribute=" "
		StoredAttribute=" "
	/>
	<VLSDeployment
		DeploySecurityInfo="False"
	/>
	<SingularCaption><![CDATA[*]]> </SingularCaption>
	<PluralCaption><![CDATA[*]]> </PluralCaption>
	<Description><![CDATA[ A recordSource is mapped to either a DataObject or a QueryObject.  Used to retrieve data from Server to HTML page or Java form.]]> </Description>
	<Comments><![CDATA[ ]]> </Comments>
	<Attributes>
		<Attribute
			Name="RepositoryName"
			PreventUserUpdates="False"
			ValueRequired="True"
			LayoutByDefault="True"
			Persistent="True"
			>
			<DataType
				DataType="VarChar"
				Size="50"
			/>
			<Validation
				ValidationType="Condition"
			/>
			<Derivation
				DerivationType="None"
			/>
			<Caption><![CDATA[Repository Name]]></Caption>
		</Attribute>
		<Attribute
			Name="ApplicationName"
			Persistent="True"
			PreventUserUpdates="False"
			ValueRequired="True"
			LayoutByDefault="True"
			>
			<DataType
				DataType="VarChar"
				Size="100"
			/>
			<Validation
				ValidationType="Condition"
			/>
			<Derivation
				DerivationType="None"
			/>
			<Caption><![CDATA[Application Name]]></Caption>
		</Attribute>
		<Attribute
			Name="FormName"
			Persistent="True"
			PreventUserUpdates="False"
			ValueRequired="True"
			LayoutByDefault="True"
			>
			<DataType
				DataType="VarChar"
				Size="100"
			/>
			<Validation
				ValidationType="Condition"
			/>
			<Derivation
				DerivationType="None"
			/>
			<Caption><![CDATA[Form Name]]></Caption>
		</Attribute>
		<Attribute
			Name="Attr_Cnt"
			Persistent="True"
			PreventUserUpdates="True"
			ValueRequired="False"
			LayoutByDefault="True"
			>
			<DataType
				DataType="Integer"
			/>
			<Derivation
				DerivationType="Count"
				SourceDataObject="RSAttribute(RSAttribute)"
			/>
			<Validation
				ValidationType="Condition"
			/>
			<Caption><![CDATA[Number Of Attributes]]></Caption>
		</Attribute>
		<Attribute
			Name="BusinessObject"
			Persistent="True"
			PreventUserUpdates="False"
			ValueRequired="True"
			LayoutByDefault="True"
			>
			<DataType
				DataType="VarChar"
				Size="50"
			/>
			<Validation
				ValidationType="Condition"
			/>
			<Derivation
				DerivationType="None"
			/>
			<Caption><![CDATA[Business Object]]></Caption>
		</Attribute>
		<Attribute
			Name="PlacedAttrCnt"
			Persistent="True"
			PreventUserUpdates="True"
			ValueRequired="False"
			LayoutByDefault="True"
			>
			<DataType
				DataType="Integer"
			/>
			<Derivation
				DerivationType="Count"
				SourceDataObject="RSAttribute(RSAttribute)"
				>
				<QualificationExpression><![CDATA[isPlaced  = True /* Yes */   ]]> </QualificationExpression>
			</Derivation>
			<Validation
				ValidationType="Condition"
			/>
			<Caption><![CDATA[Placed Attrbiute Count]]></Caption>
		</Attribute>
		<Attribute
			Name="DisplayedAttrCnt"
			Persistent="True"
			PreventUserUpdates="True"
			ValueRequired="False"
			LayoutByDefault="True"
			>
			<DataType
				DataType="Integer"
			/>
			<Derivation
				DerivationType="Count"
				SourceDataObject="RSAttribute(RSAttribute)"
				>
				<QualificationExpression><![CDATA[ isDisplayed  =  True /* Yes */  ]]> </QualificationExpression>
			</Derivation>
			<Validation
				ValidationType="Condition"
			/>
			<Caption><![CDATA[Displayed Attribute Count]]></Caption>
		</Attribute>
		<Attribute
			Name="ScalarGrid"
			Persistent="True"
			PreventUserUpdates="False"
			ValueRequired="False"
			LayoutByDefault="True"
			>
			<DataType
				DataType="VarChar"
				Size="10"
			/>
			<Derivation
				DerivationType="Default"
				>
				<DefaultValue><![CDATA['Scalar']]> </DefaultValue>
			</Derivation>
			<Validation
				ValidationType="Condition"
			/>
			<Caption><![CDATA[Scalar/Grid]]></Caption>
		</Attribute>
		<Attribute
			Name="AllowInsert"
			PreventUserUpdates="False"
			ValueRequired="True"
			LayoutByDefault="True"
			Persistent="True"
			>
			<DataType
				DataType="Boolean"
			/>
			<Derivation
				DerivationType="Default"
				>
				<DefaultValue><![CDATA[false]]></DefaultValue>
			</Derivation>
			<Validation
				ValidationType="Condition"
			/>
		</Attribute>
		<Attribute
			Name="AllowUpdate"
			PreventUserUpdates="False"
			ValueRequired="True"
			LayoutByDefault="True"
			Persistent="True"
			>
			<DataType
				DataType="Boolean"
			/>
			<Derivation
				DerivationType="Default"
				>
				<DefaultValue><![CDATA[false]]></DefaultValue>
			</Derivation>
			<Validation
				ValidationType="Condition"
			/>
		</Attribute>
		<Attribute
			Name="AllowDelete"
			PreventUserUpdates="False"
			ValueRequired="True"
			LayoutByDefault="True"
			Persistent="True"
			>
			<DataType
				DataType="Boolean"
			/>
			<Derivation
				DerivationType="Default"
				>
				<DefaultValue><![CDATA[false]]></DefaultValue>
			</Derivation>
			<Validation
				ValidationType="Condition"
			/>
		</Attribute>
		<Attribute
			Name="Relationship"
			PreventUserUpdates="False"
			ValueRequired="False"
			LayoutByDefault="True"
			Persistent="True"
			>
			<DataType
				DataType="VarChar"
				Size="150"
			/>
		</Attribute>
		<Attribute
			Name="ClassName"
			PreventUserUpdates="False"
			ValueRequired="False"
			LayoutByDefault="True"
			Persistent="True"
			>
			<DataType
				DataType="VarChar"
				Size="150"
			/>
			<Derivation
				DerivationType="None"
			/>
			<Validation
				ValidationType="Condition"
			/>
		</Attribute>
		<Attribute
			Name="RSID"
			PreventUserUpdates="False"
			ValueRequired="True"
			LayoutByDefault="True"
			Persistent="True"
			>
			<DataType
				DataType="Integer"
			/>
			<Derivation
				DerivationType="Default"
				>
				<DefaultValue><![CDATA[1]]></DefaultValue>
			</Derivation>
			<Validation
				ValidationType="Condition"
			/>
			<Caption><![CDATA[RecordSource ID]]></Caption>
		</Attribute>
		<Attribute
			Name="TransitionCnt"
			PreventUserUpdates="True"
			ValueRequired="False"
			LayoutByDefault="True"
			Persistent="True"
			>
			<DataType
				DataType="Integer"
			/>
			<Derivation
				SourceDataObject="Transition(Transition)"
				DerivationType="Count"
			/>
			<Validation
				ValidationType="Condition"
			/>
		</Attribute>
		<Attribute
			Name="RecordSourceArchetype"
			PreventUserUpdates="False"
			ValueRequired="False"
			LayoutByDefault="True"
			Persistent="True"
			>
			<DataType
				DataType="VarChar"
				Size="250"
			/>
			<Derivation
				DerivationType="None"
			/>
			<Validation
				ValidationType="Condition"
			/>
		</Attribute>
	</Attributes>
	<Indexes>
		<Index
			Name="RecordSourcePkey"
			Primary="True"
			Unique="True"
			IgnoreNulls="False"
			>
			<Index_Attribute
				Name="RepositoryName"
				Descending="False"
			/>
			<Index_Attribute
				Name="ApplicationName"
				Descending="False"
			/>
			<Index_Attribute
				Name="FormName"
				Descending="False"
			/>
			<Index_Attribute
				Name="BusinessObject"
				Descending="False"
			/>
			<Index_Attribute
				Name="RSID"
				Descending="False"
			/>
		</Index>
	</Indexes>
</DataObject>