<?xml version="1.0" encoding="iso-8859-1"?>
<!DOCTYPE DataObject SYSTEM "DataObject.dtd">
<DataObject
	DTDVersion="05.05.12"
	SurrId="0444567293.Tyler.0000"
	CodedValuesList="False"
	ImageReference=" "
	IsRemoteAccessible="False"
	UseQuotedIdentifiers="False"
	XdaConnector="SQL"
	SuperClass="DataObject"
	LockMode="AllApplicableAttributes"
	>
	<Attributes>
		<Attribute
			Name="TemplateName"
			PreventUserUpdates="False"
			ValueRequired="False"
			LayoutByDefault="True"
			Persistent="True"
			>
			<DataType
				DataType="VarChar"
				Size="50"
			/>
		</Attribute>
	</Attributes>
	<Indexes>
		<Index
			Name="PK_Template"
			Primary="True"
			Unique="True"
			IgnoreNulls="False"
			>
			<Index_Attribute
				Name="TemplateName"
				Descending="False"
			/>
		</Index>
	</Indexes>
	<SingularCaption><![CDATA[*]]></SingularCaption>
	<PluralCaption><![CDATA[*]]></PluralCaption>
	<VLSDeployment
		DeploySecurityInfo="False"
	/>
</DataObject>