<?xml version="1.0" encoding="iso-8859-1"?>
<!DOCTYPE DataObject SYSTEM "DataObject.dtd">
<DataObject
	SurrId="04445674550040"
	CodedValuesList="False"
	ImageReference=" "
	IsRemoteAccessible="False"
	UseQuotedIdentifiers="False"
	SuperClass="DataObject"
	LockMode="AllApplicableAttributes"
	XdaConnector="SQL"
	DTDVersion="05.05.12"
	>
	<CodedValuesList
		DisplayAttribute=" "
		StoredAttribute=" "
	/>
	<VLSDeployment
		DeploySecurityInfo="False"
	/>
	<SingularCaption><![CDATA[Attribute Mapper]]> </SingularCaption>
	<PluralCaption><![CDATA[Attribute Mapper]]> </PluralCaption>
	<Description><![CDATA[ This project can have many mappings between 2 or more DataObjects from multiple Repository projects - each Attribute pair represents a possible transformation to test between 2 systems.]]> </Description>
	<Comments><![CDATA[ DataType Checks - are the datatypes compatible?
Multiple Source Columns mapped to same Target?  [Handle in GUI]
Multiple Targets mapped to single Source? [Handle in GUI]]]> </Comments>
	<Attributes>
		<Attribute
			Name="ProjectName"
			PreventUserUpdates="False"
			ValueRequired="True"
			LayoutByDefault="True"
			Persistent="True"
			>
			<DataType
				DataType="VarChar"
				Size="50"
			/>
			<Validation
				ValidationType="Condition"
			/>
			<Derivation
				DerivationType="None"
			/>
			<Caption><![CDATA[Project Name]]></Caption>
		</Attribute>
		<Attribute
			Name="SourceRepositoryName"
			PreventUserUpdates="False"
			ValueRequired="True"
			LayoutByDefault="True"
			Persistent="True"
			>
			<DataType
				DataType="VarChar"
				Size="50"
			/>
			<Validation
				ValidationType="Condition"
			/>
			<Derivation
				DerivationType="None"
			/>
			<Caption><![CDATA[Source Repository Name]]></Caption>
		</Attribute>
		<Attribute
			Name="TargetRepositoryName"
			PreventUserUpdates="False"
			ValueRequired="True"
			LayoutByDefault="True"
			Persistent="True"
			>
			<DataType
				DataType="VarChar"
				Size="50"
			/>
			<Validation
				ValidationType="Condition"
			/>
			<Derivation
				DerivationType="None"
			/>
			<Caption><![CDATA[Target Repository Name]]></Caption>
		</Attribute>
		<Attribute
			Name="SourceDataObjectName"
			Persistent="True"
			PreventUserUpdates="False"
			ValueRequired="True"
			LayoutByDefault="True"
			>
			<DataType
				DataType="VarChar"
				Size="50"
			/>
			<Validation
				ValidationType="Condition"
			/>
			<Derivation
				DerivationType="None"
			/>
			<Caption><![CDATA[Source DataObject Name]]></Caption>
		</Attribute>
		<Attribute
			Name="TargetDataObjectName"
			Persistent="True"
			PreventUserUpdates="False"
			ValueRequired="True"
			LayoutByDefault="True"
			>
			<DataType
				DataType="VarChar"
				Size="50"
			/>
			<Validation
				ValidationType="Condition"
			/>
			<Derivation
				DerivationType="None"
			/>
			<Caption><![CDATA[Target DataObject Name]]></Caption>
		</Attribute>
		<Attribute
			Name="SourceAttrName"
			Persistent="True"
			PreventUserUpdates="False"
			ValueRequired="True"
			LayoutByDefault="True"
			>
			<DataType
				DataType="VarChar"
				Size="50"
			/>
			<Validation
				ValidationType="Condition"
			/>
			<Derivation
				DerivationType="None"
			/>
			<Caption><![CDATA[Source Attr Name]]></Caption>
		</Attribute>
		<Attribute
			Name="TargetAttrName"
			Persistent="True"
			PreventUserUpdates="False"
			ValueRequired="True"
			LayoutByDefault="True"
			>
			<DataType
				DataType="VarChar"
				Size="50"
			/>
			<Validation
				ValidationType="Condition"
			/>
			<Derivation
				DerivationType="None"
			/>
			<Caption><![CDATA[Target  Attr  Name]]></Caption>
		</Attribute>
		<Attribute
			Name="TransformDesc"
			PreventUserUpdates="False"
			ValueRequired="False"
			LayoutByDefault="True"
			Persistent="True"
			>
			<DataType
				DataType="VarChar"
				Size="250"
			/>
			<Derivation
				DerivationType="None"
			/>
			<Validation
				ValidationType="Condition"
			/>
			<Caption><![CDATA[Transform Requirment]]></Caption>
		</Attribute>
		<Attribute
			Name="TransformRule"
			PreventUserUpdates="False"
			ValueRequired="False"
			LayoutByDefault="True"
			Persistent="True"
			>
			<DataType
				DataType="VarChar"
				Size="15"
			/>
			<Derivation
				DerivationType="Default"
				>
				<DefaultValue><![CDATA['NONE']]></DefaultValue>
			</Derivation>
			<Validation
				ValidationType="CodedValuesList"
				CodedValuesList="Valid_TransformRule"
			/>
		</Attribute>
		<Attribute
			Name="SourceAttrDatatype"
			PreventUserUpdates="True"
			ValueRequired="False"
			LayoutByDefault="True"
			Persistent="True"
			>
			<DataType
				DataType="VarChar"
				Size="50"
			/>
			<Derivation
				SourceDataObject="SourceAttribute(Attribute)"
				SourceAttribute="SQLDataType"
				ParentReplicateIsMaintained="False"
				DerivationType="ParentReplicate"
			/>
			<Validation
				ValidationType="Condition"
			/>
		</Attribute>
		<Attribute
			Name="TargetAttrDatatype"
			PreventUserUpdates="True"
			ValueRequired="False"
			LayoutByDefault="True"
			Persistent="True"
			>
			<DataType
				DataType="VarChar"
				Size="50"
			/>
			<Derivation
				SourceDataObject="TargetAttribute(Attribute)"
				SourceAttribute="SQLDataType"
				ParentReplicateIsMaintained="False"
				DerivationType="ParentReplicate"
			/>
			<Validation
				ValidationType="Condition"
			/>
		</Attribute>
	</Attributes>
	<Indexes>
		<Index
			Name="PkeyATTRMapper"
			Primary="True"
			Unique="True"
			IgnoreNulls="False"
			>
			<Index_Attribute
				Name="ProjectName"
				Descending="False"
			/>
			<Index_Attribute
				Name="SourceRepositoryName"
				Descending="False"
			/>
			<Index_Attribute
				Name="TargetRepositoryName"
				Descending="False"
			/>
			<Index_Attribute
				Name="SourceDataObjectName"
				Descending="False"
			/>
			<Index_Attribute
				Name="TargetDataObjectName"
				Descending="False"
			/>
			<Index_Attribute
				Name="SourceAttrName"
				Descending="False"
			/>
			<Index_Attribute
				Name="TargetAttrName"
				Descending="False"
			/>
		</Index>
	</Indexes>
</DataObject>